{
  "contract_version": "creation-studio.traceable-planning-request/1",
  "coordinate_frame": {
    "id": "stock-fixed-coupon-xy",
    "name": "stock-fixed rectangular coupon"
  },
  "geometry": {
    "id": "geom-rectangle-planned-1",
    "revision": "rev-1"
  },
  "machine_profile": {
    "id": "synthetic-router-mm"
  },
  "operation": {
    "centerline": {
      "x_max_mm": 60.0,
      "x_min_mm": 20.0,
      "y_max_mm": 35.0,
      "y_min_mm": 15.0
    },
    "type": "closed_rectangular_contour"
  },
  "package_id": "pkg-synthetic-rectangle-planned-1",
  "positional_tolerance_mm": 0.05,
  "removal_region": {
    "max_depth_mm": 3.0,
    "x_max_mm": 70.0,
    "x_min_mm": 10.0,
    "y_max_mm": 45.0,
    "y_min_mm": 5.0
  },
  "request_id": "req-rectangle-planned-1",
  "stock": {
    "id": "stock-coupon-rect-80x50x10",
    "material_id": "hardwood",
    "x_mm": 80.0,
    "y_mm": 50.0,
    "z_mm": 10.0
  },
  "strategy": {
    "clearance_mm": 5.0,
    "depth_levels_mm": [
      1.0,
      2.0
    ],
    "id": "strat-rectangle-planned-1",
    "stepdown_mm": 1.0,
    "stock_allowance_mm": 0.0,
    "travel_height_mm": 5.0
  },
  "subject": {
    "id": "specimen-synthetic-rectangle-1"
  },
  "tooling": {
    "diameter_mm": 6.35,
    "id": "endmill_1_4",
    "kind": "flat_end_mill",
    "orientation": "fixed"
  },
  "units": "mm",
  "upstream_artifacts": [
    {
      "artifact_id": "prop-rectangle-planned-1",
      "contract_id": "experimental.cam-assist.proposal",
      "contract_version": "fixture-1",
      "package_ref": "proposal.json",
      "role": "proposal",
      "sha256": "9f6b62f266fa2f5508709cc3bbd9b318c7ca7e17222e4146f728eb7795b4fb06"
    },
    {
      "artifact_id": "val-rectangle-planned-1",
      "contract_id": "experimental.cam-assist.validation",
      "contract_version": "fixture-1",
      "package_ref": "validation.json",
      "role": "validation",
      "sha256": "14e55e0407c7190d2945ac3eb6671e284898e3edc18746910f912bfc331ac116"
    },
    {
      "artifact_id": "adm-rectangle-planned-1",
      "contract_id": "experimental.cam-assist.admission",
      "contract_version": "fixture-1",
      "package_ref": "admission.json",
      "role": "admission",
      "sha256": "8bf1af2a03f19f78d56045733a029da725840229148af25f2dd13a136f85b86c"
    },
    {
      "artifact_id": "geom-rectangle-planned-1",
      "contract_id": "experimental.creation-studio.geometry",
      "contract_version": "fixture-1",
      "package_ref": "geometry.json",
      "role": "geometry",
      "sha256": "66be9a755dc764ae49fa0cf36fb0dd59609c2d74f041ebd7eb859cca602a122c"
    },
    {
      "artifact_id": "subject-rectangle-planned-1",
      "contract_id": "experimental.creation-studio.subject",
      "contract_version": "fixture-1",
      "package_ref": "subject.json",
      "role": "subject",
      "sha256": "958db36f878436adfd53cb388dea1db764acc85013222d47f8af4c5c3e534767"
    }
  ],
  "workflow_origin": "imported"
}
